[
  {
    "id": "summe",
    "name": "SumMe",
    "role": "core",
    "task": "Generic extractive video summarization",
    "domain": "User videos: holidays, events, sports",
    "videos": 25,
    "duration": "Approximately 1–6 minutes/video",
    "annotations": "User-selected temporal intervals; human summary duration 5–15% of source",
    "annotators": "15–18 per video",
    "granularity": "Temporal intervals mapped to original frames",
    "summary_format": "Keyshot skim / binary temporal mask",
    "split": "No original canonical learning split; later random 80/20 canonical, augmented, and transfer protocols",
    "metrics": [
      "Temporal-overlap F1 (original mean-user; later max-user)"
    ],
    "license": "Not independently verified; repository MIT license must not be applied to source videos",
    "availability": "Institutional archive cited; full archive download and integrity not verified in this run",
    "official_url": "https://link.springer.com/chapter/10.1007/978-3-319-10584-0_33",
    "download_url": "https://data.vision.ee.ethz.ch/cvl/SumMe/SumMe.zip",
    "annotation_url": "https://data.vision.ee.ethz.ch/cvl/SumMe/SumMe.zip",
    "mirrors": "Not reported",
    "preprocessing": "Later pipelines: 2 fps, original-frame index mapping, KTS, usually 15% budget. These are method conventions, not native annotations.",
    "features": "Later paper-author packages: GoogLeNet pool5 HDF5 (2 fps, 1024-D) and MSVA I3D RGB/flow; original dataset release has no deep tensors. See docs/03-datasets.md. ResNet-101 and VideoMAE ready-made tensors not independently verified.",
    "checksums": "Not independently verified",
    "leakage_risks": "Small corpus; external feature pretraining contamination unknown; do not use human-derived HDF5 fields for unsupervised checkpoint selection",
    "limitations": "Mean-user and max-user F1 are incompatible; source durations and checksums were not remeasured",
    "verified_on": "2026-09-08",
    "sources": [
      "https://link.springer.com/chapter/10.1007/978-3-319-10584-0_33",
      "https://www.cs.utexas.edu/~grauman/papers/zhang-eccv2016-lstm-summ.pdf",
      "https://www.cs.utexas.edu/~grauman/papers/zhang-eccv2016-lstm-summ-supp.pdf",
      "https://github.com/kezhang-cs/Video-Summarization-with-LSTM"
    ]
  },
  {
    "id": "tvsum",
    "name": "TVSum / TVSum50",
    "role": "core",
    "task": "Generic extractive video summarization",
    "domain": "10 web-video event categories",
    "videos": 50,
    "duration": "Approximately 2–10 minutes/video",
    "annotations": "1–5 importance rating for every 2-second unit; 1000 video-level responses",
    "annotators": "20 per video",
    "granularity": "Uniform 2-second annotation units",
    "summary_format": "Importance scores; reference keyshots require decoding",
    "split": "No original canonical learning split; later random 80/20 and five-split conventions",
    "metrics": [
      "Temporal-overlap F1, mean across users",
      "Kendall tau / Spearman rho for score ranking (later diagnostic)"
    ],
    "license": "Video source release identifies Creative Commons CC-BY 3.0; code and derived features need their own license checks",
    "availability": "Official README advertises hosted videos and URLs; author download directory is canonical. Full archive not downloaded.",
    "official_url": "https://github.com/yalesong/tvsum",
    "download_url": "https://people.csail.mit.edu/yalesong/tvsum/",
    "annotation_url": "https://people.csail.mit.edu/yalesong/tvsum/tvsum50_ver_1_1.tgz",
    "mirrors": "Not reported",
    "preprocessing": "Original annotation uses 2-second units; later KTS reference construction changes the protocol",
    "features": "Later paper-author packages: GoogLeNet pool5 HDF5 (2 fps, 1024-D) and MSVA I3D RGB/flow; original dataset release has no deep tensors. See docs/03-datasets.md. ResNet-101 and VideoMAE ready-made tensors not independently verified.",
    "checksums": "Not independently verified",
    "leakage_risks": "Titles were visible during annotation; test reference scores must not tune models; public web-video contamination unknown",
    "limitations": "Do not equate raw ratings with binary user summaries or mix original units and shared-KTS references",
    "verified_on": "2026-09-08",
    "sources": [
      "https://github.com/yalesong/tvsum",
      "https://people.csail.mit.edu/yalesong/publications/SongVSJ2015CVPR.pdf",
      "https://github.com/yalesong/tvsum/blob/master/matlab/script_evaluate_result.m"
    ]
  },
  {
    "id": "ovp",
    "name": "OVP / VSUMM Open Video subset",
    "role": "adjacent",
    "task": "Static keyframe summarization; auxiliary training for later temporal methods",
    "domain": "Open Video documentaries",
    "videos": 50,
    "duration": "Published range 1–4 minutes; author README approximately 75 minutes total",
    "annotations": "Static user-selected keyframes",
    "annotators": "5 summaries per video",
    "granularity": "Selected still frames",
    "summary_format": "Static keyframe set",
    "split": "No canonical split; later LSTM work uses all 50 as auxiliary training data",
    "metrics": [
      "CUS / CUSA / CUSE",
      "Content-matched keyframe precision, recall and F1 in later seqDPP protocol"
    ],
    "license": "Not reported",
    "availability": "Author README links dataset, user-summary and evaluation archives; archive bytes not fetched in this run",
    "official_url": "https://github.com/sandraavila/vsumm",
    "download_url": "https://www.dropbox.com/s/g0e64b4qfnuual1/database.zip?dl=1",
    "annotation_url": "https://www.dropbox.com/s/ilt1jpclzs2o18v/UserSummary.zip?dl=1",
    "mirrors": "Not reported",
    "preprocessing": "Native MPEG-1, 30 fps, 352x240; oracle keyframe-to-score conversions are method-derived labels",
    "features": "seqDPP author Fisher/saliency/context bundle; later GoogLeNet derivatives advertised, current download not verified",
    "checksums": "Not independently verified",
    "leakage_risks": "Derived oracle labels introduce human supervision; avoid treating auxiliary label transfer as unsupervised training",
    "limitations": "Content-matched still-frame metrics are not temporal-overlap F1; no dense native importance curve",
    "verified_on": "2026-09-08",
    "sources": [
      "https://github.com/sandraavila/vsumm",
      "https://ic.unicamp.br/~sandra/pdf/papers/avila_PRL11.pdf",
      "https://www.cs.utexas.edu/~grauman/papers/zhang-eccv2016-lstm-summ-supp.pdf"
    ]
  },
  {
    "id": "youtube-vsumm",
    "name": "YouTube / VSUMM web-video corpus",
    "role": "adjacent",
    "task": "Static keyframe summarization; auxiliary training for later temporal methods",
    "domain": "Cartoons, news, sports, commercials, TV, home videos",
    "videos": 50,
    "duration": "Published range 1–10 minutes/video; current archive not remeasured",
    "annotations": "Static user-selected keyframes",
    "annotators": "5 summaries per video",
    "granularity": "Selected still frames",
    "summary_format": "Static keyframe set",
    "split": "Original release 50 videos; seqDPP/LSTM use a 39-video non-cartoon subset",
    "metrics": [
      "CUS / CUSA / CUSE",
      "Content-matched keyframe precision, recall and F1 in later seqDPP protocol"
    ],
    "license": "Not reported",
    "availability": "Author release links web-video archive and user summaries; no byte integrity verification in this run",
    "official_url": "https://github.com/sandraavila/vsumm",
    "download_url": "https://www.dropbox.com/s/wxpj91cm9m3ikn0/newDatabase.zip?dl=1",
    "annotation_url": "https://www.dropbox.com/s/7rtbyeo64hk8ot7/newUserSummary.zip?dl=1",
    "mirrors": "Not reported",
    "preprocessing": "Name exact 50-video release or 39-video non-cartoon subset; derived oracle conversion must be documented",
    "features": "seqDPP Fisher/saliency/context bundle for 39-video subset; later GoogLeNet derivatives advertised but not downloaded",
    "checksums": "Not independently verified",
    "leakage_risks": "Same videos may be reused by different auxiliary bundles; labels remain human-derived after conversion",
    "limitations": "Not the YouTube Highlights dataset; temporal F1 and static matching are incompatible",
    "verified_on": "2026-09-08",
    "sources": [
      "https://github.com/sandraavila/vsumm",
      "https://ic.unicamp.br/~sandra/pdf/papers/avila_PRL11.pdf",
      "https://www.cs.utexas.edu/~grauman/papers/zhang-eccv2016-lstm-summ.pdf",
      "https://www.cs.utexas.edu/~grauman/papers/zhang-eccv2016-lstm-summ-supp.pdf"
    ]
  },
  {
    "id": "videoxum",
    "name": "VideoXum",
    "role": "core",
    "task": "Cross-modal visual and textual video summarization",
    "domain": "ActivityNet-Captions activity videos",
    "videos": 14001,
    "duration": "Paper: 10–755 seconds; mean 124.2 seconds",
    "annotations": "10 visual summary masks per video; event-caption text; 140010 visual/text pairs",
    "annotators": "10 visual summaries per video; text references are shared caption lists, not ten independent texts",
    "granularity": "Uniform 1-fps visual positions; temporal event captions",
    "summary_format": "Binary visual mask plus textual summary",
    "split": "8000 train / 2001 validation / 4000 test",
    "metrics": [
      "F1-Avg",
      "F1-Max",
      "Kendall tau",
      "Spearman rho",
      "BLEU-4",
      "METEOR",
      "ROUGE-L",
      "CIDEr",
      "VT-CLIPScore"
    ],
    "license": "Official Hugging Face dataset card: Apache-2.0; this does not relicense underlying ActivityNet/YouTube videos",
    "availability": "Official Hugging Face annotations and features advertised; raw video bytes not bundled",
    "official_url": "https://videoxum.github.io/",
    "download_url": "https://huggingface.co/datasets/jylins/videoxum/tree/main",
    "annotation_url": "https://huggingface.co/datasets/jylins/videoxum",
    "mirrors": "Not reported",